{
  "schema_version": 1,
  "format": "xm",
  "header": {
    "title": "slumberjack",
    "channel_count": 8,
    "frequency_table": "linear",
    "bpm": 84,
    "tick_speed": 3,
    "main_volume": 255,
    "restart_position": 0
  },
  "orders": [
    5,
    5,
    5,
    5,
    6,
    0,
    1,
    2,
    3,
    4,
    7,
    8,
    9,
    10,
    12,
    11,
    13,
    14,
    15,
    16,
    17,
    18,
    19,
    20,
    21,
    22,
    26,
    5,
    5,
    5,
    23,
    12,
    11,
    13,
    14,
    15,
    16,
    17,
    18,
    24,
    25,
    25
  ],
  "patterns": [
    {
      "index": 0,
      "rows": 32,
      "channels": 8,
      "effect_slots": 2,
      "non_empty_cells": 55,
      "expanded_cell_checksum": 4352531299452341587
    },
    {
      "index": 1,
      "rows": 32,
      "channels": 8,
      "effect_slots": 2,
      "non_empty_cells": 55,
      "expanded_cell_checksum": 1683590722470429511
    },
    {
      "index": 2,
      "rows": 32,
      "channels": 8,
      "effect_slots": 2,
      "non_empty_cells": 57,
      "expanded_cell_checksum": 18145963527085100240
    },
    {
      "index": 3,
      "rows": 32,
      "channels": 8,
      "effect_slots": 2,
      "non_empty_cells": 61,
      "expanded_cell_checksum": 13280087533707561610
    },
    {
      "index": 4,
      "rows": 32,
      "channels": 8,
      "effect_slots": 2,
      "non_empty_cells": 85,
      "expanded_cell_checksum": 943208545892002745
    },
    {
      "index": 5,
      "rows": 12,
      "channels": 8,
      "effect_slots": 2,
      "non_empty_cells": 13,
      "expanded_cell_checksum": 12489060017010657305
    },
    {
      "index": 6,
      "rows": 32,
      "channels": 8,
      "effect_slots": 2,
      "non_empty_cells": 48,
      "expanded_cell_checksum": 9939997291419807531
    },
    {
      "index": 7,
      "rows": 32,
      "channels": 8,
      "effect_slots": 2,
      "non_empty_cells": 87,
      "expanded_cell_checksum": 2313551571673762676
    },
    {
      "index": 8,
      "rows": 32,
      "channels": 8,
      "effect_slots": 2,
      "non_empty_cells": 89,
      "expanded_cell_checksum": 17654322799807108908
    },
    {
      "index": 9,
      "rows": 32,
      "channels": 8,
      "effect_slots": 2,
      "non_empty_cells": 109,
      "expanded_cell_checksum": 7776135277434398069
    },
    {
      "index": 10,
      "rows": 32,
      "channels": 8,
      "effect_slots": 2,
      "non_empty_cells": 117,
      "expanded_cell_checksum": 1972296408400378429
    },
    {
      "index": 11,
      "rows": 32,
      "channels": 8,
      "effect_slots": 2,
      "non_empty_cells": 150,
      "expanded_cell_checksum": 2878131265427685974
    },
    {
      "index": 12,
      "rows": 32,
      "channels": 8,
      "effect_slots": 2,
      "non_empty_cells": 179,
      "expanded_cell_checksum": 13831134127795197201
    },
    {
      "index": 13,
      "rows": 32,
      "channels": 8,
      "effect_slots": 2,
      "non_empty_cells": 139,
      "expanded_cell_checksum": 12502932663087755049
    },
    {
      "index": 14,
      "rows": 32,
      "channels": 8,
      "effect_slots": 2,
      "non_empty_cells": 154,
      "expanded_cell_checksum": 8194877084244243363
    },
    {
      "index": 15,
      "rows": 32,
      "channels": 8,
      "effect_slots": 2,
      "non_empty_cells": 163,
      "expanded_cell_checksum": 17309390519031609329
    },
    {
      "index": 16,
      "rows": 32,
      "channels": 8,
      "effect_slots": 2,
      "non_empty_cells": 166,
      "expanded_cell_checksum": 1226189894423959025
    },
    {
      "index": 17,
      "rows": 32,
      "channels": 8,
      "effect_slots": 2,
      "non_empty_cells": 155,
      "expanded_cell_checksum": 1642589678940105961
    },
    {
      "index": 18,
      "rows": 32,
      "channels": 8,
      "effect_slots": 2,
      "non_empty_cells": 150,
      "expanded_cell_checksum": 8357127753243150491
    },
    {
      "index": 19,
      "rows": 32,
      "channels": 8,
      "effect_slots": 2,
      "non_empty_cells": 116,
      "expanded_cell_checksum": 6973898191087056839
    },
    {
      "index": 20,
      "rows": 32,
      "channels": 8,
      "effect_slots": 2,
      "non_empty_cells": 108,
      "expanded_cell_checksum": 14432342454203627239
    },
    {
      "index": 21,
      "rows": 32,
      "channels": 8,
      "effect_slots": 2,
      "non_empty_cells": 112,
      "expanded_cell_checksum": 5241903599083356318
    },
    {
      "index": 22,
      "rows": 32,
      "channels": 8,
      "effect_slots": 2,
      "non_empty_cells": 115,
      "expanded_cell_checksum": 11388455103465798743
    },
    {
      "index": 23,
      "rows": 32,
      "channels": 8,
      "effect_slots": 2,
      "non_empty_cells": 128,
      "expanded_cell_checksum": 6788326034181378153
    },
    {
      "index": 24,
      "rows": 32,
      "channels": 8,
      "effect_slots": 2,
      "non_empty_cells": 88,
      "expanded_cell_checksum": 1735737831356413787
    },
    {
      "index": 25,
      "rows": 32,
      "channels": 8,
      "effect_slots": 2,
      "non_empty_cells": 57,
      "expanded_cell_checksum": 17948254945682073493
    },
    {
      "index": 26,
      "rows": 12,
      "channels": 8,
      "effect_slots": 2,
      "non_empty_cells": 22,
      "expanded_cell_checksum": 1832171615762794171
    }
  ],
  "instruments": [
    {
      "index": 0,
      "name": "",
      "sample_slots": [
        0,
        null,
        null,
        null,
        null,
        null,
        null,
        null,
        null,
        null,
        null,
        null,
        null,
        null,
        null,
        null
      ],
      "note_sample_map_checksum": 5078316153582996741,
      "volume_envelope": {
        "point_count": 4,
        "sustain_point": 0,
        "loop_start_point": 0,
        "loop_end_point": 3,
        "flags": 7,
        "points": [
          {
            "frame": 0,
            "value": 256
          },
          {
            "frame": 1,
            "value": 64
          },
          {
            "frame": 2,
            "value": 128
          },
          {
            "frame": 3,
            "value": 64
          },
          {
            "frame": 0,
            "value": 0
          },
          {
            "frame": 0,
            "value": 0
          },
          {
            "frame": 0,
            "value": 0
          },
          {
            "frame": 0,
            "value": 0
          },
          {
            "frame": 0,
            "value": 0
          },
          {
            "frame": 0,
            "value": 0
          },
          {
            "frame": 0,
            "value": 0
          },
          {
            "frame": 0,
            "value": 0
          }
        ]
      },
      "panning_envelope": {
        "point_count": 4,
        "sustain_point": 0,
        "loop_start_point": 0,
        "loop_end_point": 3,
        "flags": 5,
        "points": [
          {
            "frame": 0,
            "value": 128
          },
          {
            "frame": 25,
            "value": 192
          },
          {
            "frame": 125,
            "value": 96
          },
          {
            "frame": 150,
            "value": 128
          },
          {
            "frame": 80,
            "value": 128
          },
          {
            "frame": 80,
            "value": 128
          },
          {
            "frame": 80,
            "value": 128
          },
          {
            "frame": 90,
            "value": 128
          },
          {
            "frame": 100,
            "value": 128
          },
          {
            "frame": 110,
            "value": 128
          },
          {
            "frame": 120,
            "value": 128
          },
          {
            "frame": 130,
            "value": 128
          }
        ]
      },
      "vibrato": {
        "waveform": 0,
        "sweep": 16,
        "depth": 16,
        "rate": 42
      },
      "volume_fadeout": 480
    },
    {
      "index": 1,
      "name": " raina",
      "sample_slots": [
        16,
        null,
        null,
        null,
        null,
        null,
        null,
        null,
        null,
        null,
        null,
        null,
        null,
        null,
        null,
        null
      ],
      "note_sample_map_checksum": 11547897413433257221,
      "volume_envelope": {
        "point_count": 4,
        "sustain_point": 0,
        "loop_start_point": 0,
        "loop_end_point": 3,
        "flags": 7,
        "points": [
          {
            "frame": 0,
            "value": 256
          },
          {
            "frame": 1,
            "value": 64
          },
          {
            "frame": 2,
            "value": 128
          },
          {
            "frame": 3,
            "value": 64
          },
          {
            "frame": 0,
            "value": 0
          },
          {
            "frame": 0,
            "value": 0
          },
          {
            "frame": 0,
            "value": 0
          },
          {
            "frame": 0,
            "value": 0
          },
          {
            "frame": 0,
            "value": 0
          },
          {
            "frame": 0,
            "value": 0
          },
          {
            "frame": 0,
            "value": 0
          },
          {
            "frame": 0,
            "value": 0
          }
        ]
      },
      "panning_envelope": {
        "point_count": 4,
        "sustain_point": 0,
        "loop_start_point": 0,
        "loop_end_point": 3,
        "flags": 5,
        "points": [
          {
            "frame": 0,
            "value": 128
          },
          {
            "frame": 25,
            "value": 64
          },
          {
            "frame": 125,
            "value": 160
          },
          {
            "frame": 150,
            "value": 128
          },
          {